{
  "$schema": "https://json-schema.org/draft/2020-12/schema",
  "title": "Diago architecture explorer",
  "type": "object",
  "additionalProperties": false,
  "required": [
    "schemaVersion",
    "title",
    "root",
    "evidence",
    "components",
    "views"
  ],
  "properties": {
    "schemaVersion": {
      "const": 1
    },
    "title": {
      "type": "string",
      "minLength": 1,
      "maxLength": 120
    },
    "summary": {
      "type": "string",
      "minLength": 1,
      "maxLength": 1000
    },
    "root": {
      "type": "string",
      "pattern": "^[a-zA-Z][a-zA-Z0-9_-]{0,63}$"
    },
    "evidence": {
      "type": "array",
      "minItems": 0,
      "maxItems": 400,
      "items": {
        "type": "object",
        "additionalProperties": false,
        "required": [
          "id",
          "source"
        ],
        "properties": {
          "id": {
            "type": "string",
            "pattern": "^[a-zA-Z][a-zA-Z0-9_-]{0,63}$"
          },
          "source": {
            "type": "string",
            "minLength": 1,
            "maxLength": 500
          },
          "note": {
            "type": "string",
            "minLength": 1,
            "maxLength": 1000
          }
        }
      }
    },
    "components": {
      "type": "array",
      "minItems": 1,
      "maxItems": 200,
      "items": {
        "type": "object",
        "additionalProperties": false,
        "required": [
          "id",
          "label",
          "status"
        ],
        "properties": {
          "id": {
            "type": "string",
            "pattern": "^[a-zA-Z][a-zA-Z0-9_-]{0,63}$"
          },
          "label": {
            "type": "string",
            "minLength": 1,
            "maxLength": 80
          },
          "description": {
            "type": "string",
            "minLength": 1,
            "maxLength": 2000
          },
          "path": {
            "type": "string",
            "minLength": 1,
            "maxLength": 500
          },
          "status": {
            "enum": [
              "verified",
              "assumption",
              "proposed"
            ]
          },
          "evidence": {
            "type": "array",
            "minItems": 0,
            "maxItems": 20,
            "items": {
              "type": "string",
              "pattern": "^[a-zA-Z][a-zA-Z0-9_-]{0,63}$"
            },
            "uniqueItems": true
          },
          "detail": {
            "type": "string",
            "pattern": "^[a-zA-Z][a-zA-Z0-9_-]{0,63}$"
          }
        },
        "allOf": [
          {
            "if": {
              "properties": {
                "status": {
                  "const": "verified"
                }
              }
            },
            "then": {
              "required": [
                "evidence"
              ],
              "properties": {
                "evidence": {
                  "type": "array",
                  "minItems": 1,
                  "maxItems": 20,
                  "items": {
                    "type": "string",
                    "pattern": "^[a-zA-Z][a-zA-Z0-9_-]{0,63}$"
                  },
                  "uniqueItems": true
                }
              }
            }
          }
        ]
      }
    },
    "views": {
      "type": "array",
      "minItems": 1,
      "maxItems": 40,
      "items": {
        "type": "object",
        "additionalProperties": false,
        "required": [
          "id",
          "title",
          "nodes",
          "edges"
        ],
        "properties": {
          "id": {
            "type": "string",
            "pattern": "^[a-zA-Z][a-zA-Z0-9_-]{0,63}$"
          },
          "title": {
            "type": "string",
            "minLength": 1,
            "maxLength": 120
          },
          "question": {
            "type": "string",
            "minLength": 1,
            "maxLength": 500
          },
          "nodes": {
            "type": "array",
            "minItems": 1,
            "maxItems": 12,
            "items": {
              "type": "string",
              "pattern": "^[a-zA-Z][a-zA-Z0-9_-]{0,63}$"
            },
            "uniqueItems": true
          },
          "edges": {
            "type": "array",
            "minItems": 0,
            "maxItems": 20,
            "items": {
              "type": "object",
              "additionalProperties": false,
              "required": [
                "from",
                "to",
                "label",
                "status"
              ],
              "properties": {
                "arrow": { "enum": ["directed", "response", "event", "dependency", "bidirectional", "association"] },
                "from": {
                  "type": "string",
                  "pattern": "^[a-zA-Z][a-zA-Z0-9_-]{0,63}$"
                },
                "to": {
                  "type": "string",
                  "pattern": "^[a-zA-Z][a-zA-Z0-9_-]{0,63}$"
                },
                "label": {
                  "type": "string",
                  "minLength": 1,
                  "maxLength": 120
                },
                "status": {
                  "enum": [
                    "verified",
                    "assumption",
                    "proposed"
                  ]
                },
                "evidence": {
                  "type": "array",
                  "minItems": 0,
                  "maxItems": 20,
                  "items": {
                    "type": "string",
                    "pattern": "^[a-zA-Z][a-zA-Z0-9_-]{0,63}$"
                  },
                  "uniqueItems": true
                }
              },
              "allOf": [
                {
                  "if": {
                    "properties": {
                      "status": {
                        "const": "verified"
                      }
                    }
                  },
                  "then": {
                    "required": [
                      "evidence"
                    ],
                    "properties": {
                      "evidence": {
                        "type": "array",
                        "minItems": 1,
                        "maxItems": 20,
                        "items": {
                          "type": "string",
                          "pattern": "^[a-zA-Z][a-zA-Z0-9_-]{0,63}$"
                        },
                        "uniqueItems": true
                      }
                    }
                  }
                }
              ]
            }
          }
        }
      }
    }
  }
}
