{
  "schemaVersion": 1,
  "title": "Diago",
  "summary": "Evidence-grounded diagrams. A shared model, a clear view, and sources you can inspect.",
  "root": "overview",
  "components": [
    {
      "id": "cli",
      "label": "CLI",
      "path": "bin/diago.mjs",
      "status": "verified",
      "evidence": [
        "cli-src"
      ],
      "description": "Accepts a saved JSON document and writes an artifact."
    },
    {
      "id": "mcp",
      "label": "MCP tools",
      "path": "mcp/tools.mjs",
      "status": "verified",
      "evidence": [
        "mcp-src"
      ],
      "description": "Exposes the same local operations to coding assistants."
    },
    {
      "id": "rendering",
      "label": "Rendering",
      "path": "lib/",
      "status": "verified",
      "evidence": [
        "registry-src"
      ],
      "description": "Routes single diagrams and multi-view explorer documents to their appropriate output pipeline.",
      "detail": "render-detail"
    },
    {
      "id": "viewer",
      "label": "Offline explorer",
      "path": "lib/explorer/viewer.js",
      "status": "verified",
      "evidence": [
        "viewer-src"
      ],
      "description": "Presents component details and source evidence in the browser."
    },
    {
      "id": "native",
      "label": "Diagram registry",
      "path": "lib/renderer-registry.mjs",
      "status": "verified",
      "evidence": [
        "registry-src"
      ],
      "description": "Validates and renders the eight existing diagram types."
    },
    {
      "id": "explorer",
      "label": "Explorer composer",
      "path": "lib/explorer.mjs",
      "status": "verified",
      "evidence": [
        "explorer-src"
      ],
      "description": "Stores shared components once and embeds the viewer template."
    },
    {
      "id": "validator",
      "label": "Explorer validation",
      "path": "lib/explorer.mjs",
      "status": "verified",
      "evidence": [
        "explorer-src"
      ],
      "description": "Checks identities, evidence, navigation cycles, and complexity budgets.",
      "detail": "validation-detail"
    },
    {
      "id": "references",
      "label": "Reference checks",
      "path": "lib/explorer.mjs",
      "status": "verified",
      "evidence": [
        "explorer-src"
      ],
      "description": "Rejects missing node, view, and evidence references."
    },
    {
      "id": "budget",
      "label": "Bounded complexity",
      "path": "lib/explorer.mjs",
      "status": "verified",
      "evidence": [
        "explorer-src"
      ],
      "description": "Limits per-view nodes, total views, input bytes, and drill-down depth."
    }
  ],
  "evidence": [
    {
      "id": "cli-src",
      "source": "bin/diago.mjs",
      "note": "Dispatches user commands to the corresponding implementation."
    },
    {
      "id": "mcp-src",
      "source": "mcp/tools.mjs",
      "note": "Validates tool arguments and dispatches local calls."
    },
    {
      "id": "registry-src",
      "source": "lib/renderer-registry.mjs",
      "note": "Selects the bundled or native renderer and validates before rendering."
    },
    {
      "id": "explorer-src",
      "source": "lib/explorer.mjs",
      "note": "Validates the shared model and builds a standalone artifact."
    },
    {
      "id": "viewer-src",
      "source": "lib/explorer/viewer.js",
      "note": "Navigates views and displays the supplied evidence offline."
    }
  ],
  "views": [
    {
      "id": "overview",
      "title": "One system. Two entry points.",
      "question": "How does Diago turn engineering evidence into a local artifact?",
      "nodes": [
        "cli",
        "mcp",
        "rendering",
        "viewer"
      ],
      "edges": [
        {
          "from": "cli",
          "to": "rendering",
          "label": "Dispatch a saved document",
          "status": "verified",
          "evidence": [
            "cli-src"
          ]
        },
        {
          "from": "mcp",
          "to": "rendering",
          "label": "Dispatch validated tool arguments",
          "status": "verified",
          "evidence": [
            "mcp-src"
          ]
        },
        {
          "from": "rendering",
          "to": "viewer",
          "label": "Build an offline explorer artifact",
          "status": "verified",
          "evidence": [
            "explorer-src"
          ]
        }
      ]
    },
    {
      "id": "render-detail",
      "title": "Inside the rendering boundary",
      "question": "Which pipeline owns each kind of output?",
      "nodes": [
        "native",
        "explorer",
        "validator",
        "viewer"
      ],
      "edges": [
        {
          "from": "explorer",
          "to": "validator",
          "label": "Validate the shared document",
          "status": "verified",
          "evidence": [
            "explorer-src"
          ]
        },
        {
          "from": "explorer",
          "to": "viewer",
          "label": "Embed the viewer and source data",
          "status": "verified",
          "evidence": [
            "explorer-src"
          ]
        }
      ]
    },
    {
      "id": "validation-detail",
      "title": "Small inputs. Explicit guarantees.",
      "question": "What does explorer validation actually establish?",
      "nodes": [
        "references",
        "budget"
      ],
      "edges": []
    },
    {
      "id": "entry-points",
      "title": "Agent and terminal entry points",
      "question": "Where can the same document enter the system?",
      "nodes": [
        "cli",
        "mcp",
        "explorer"
      ],
      "edges": [
        {
          "from": "cli",
          "to": "explorer",
          "label": "Explore command",
          "status": "verified",
          "evidence": [
            "cli-src"
          ]
        },
        {
          "from": "mcp",
          "to": "explorer",
          "label": "render_explorer tool",
          "status": "verified",
          "evidence": [
            "mcp-src"
          ]
        }
      ]
    }
  ]
}
